"순번","민원제목","민원내용","민원등록일","민원수정일","민원답변일","처리부서","진행상태","민원인주소_법정동"
"65","시내버스 건의합니다.","안녕하세요:)저는 30번대 시내버스를 자주 이용하는 시민입니다.다름이 아니고 일부 시내버스 기사님들의 난폭운전과 불친절함, 그 외 배차시간을 지키지 않는 등의 문제로 이렇게 건의글을 올립니다.30번대 버스는 황등, 함라, 삼기 등 시내에서 시골까지 운행하기 때문에 학생들 뿐만 아니라 어른신들이 많이 이용하십니다. 특히 북부시장 5일장이 열리는 날에는 어르신들 승하차가 상대적으로 많습니다.그럼에도 불구하고 일부 기사님들 운전하실 때 안전이라고는 찾아볼 수가 없네요.뭐가 그렇게 급하신건지 과속은 물론이고 급정거, 급출발, 급커브....젊은 학생들도 손잡이를 잡고도 휘청휘청거리는데 어르신들이야 오죽하겠습니까?덧붙여서 차가 완전히 정차하지도 않았는데 뒷문을 열어주시네요^^시내버스 안전/서비스교육 안하시는건가요ㅠㅠ 그리고 배차간격, 시간표 문제로 예전에도 게시글을 올린적이 있었는데...여전히 시간표가 없는 정류장들이 많습니다. 예전에 한 번은 버스에 문제가 생겨서 2대-3대 가량 빼먹은 상태에서 한시간 넘게 기다리다가 탄 적이 있었습니다.그 때 당시 한겨울이었는데 기다리다 못해 교통과로 전화했을 때 교통과도 상황을 잘 알고 계시지 않더라구요. 그 후 알아봐주시고 다시 연락주기는 했지만 곧 도착하니 조금만 더 기다려달라는 말씀만 하시고..별다른 조치없이 그후로도 20분을 더 기다렸던 기억이 있습니다.우리는 전주, 군산 심지어 화순군, 장성군에도 있는 실시간버스어플도 없고...배차간격이 큰 정류장에서는 버스를 한 번 놓치면 더울때나 추울때나 언제 올지 모르는 버스를 마냥 기다리고만 있어야합니다.익산은 실시간버스 어플리케이션 개발이 그렇게 힘든겁니까? ㅠㅠ 모쪼록 일부 기사님들 안전/서비스, 배차시간표 개선 바랍니다.  추운 날씨에도 시민들을 위해 수고해주셔서 감사합니다.좋은하루 보내세요.","2017-01-25","2017-01-25","2017-01-26","교통행정과","처리완료","고미술로"
"66","왜가리 (으악색) 문제를 해결해 달라고 글을 올렸는데..","7월 7일에 글을 올렸는데접수만 해놓고 왜 해결을 안해주시는지요...조촌동.에코리버 아파트 앞의 산을 한번 보세요...몇천마리가 산에 앉아서 보기에는 장관인지 모르지만..살고 있는 사람은 정말 끔찍합니다.얼마나 많은 새들이  시끄럽게 하는지그리고 새똥 냄새가 얼마나 지독한지...문을 못 열어논다고요..여름에 더운데.. 에어컨만 켜놓을 수는 없잖아요더 이상 이 새소리듣고 싶지 않아요날도 더운데 스트레스가 이만저만이 아닙니다.","2016-07-25","2016-07-25","2016-08-02","직소민원팀","처리완료","이문로12길"
"67","(SPP-1711-2300395)교통방해 현수막 제거 * 첨부파일촬영시간 안내(안전신","전라북도 부안군 진서면 석포리 702-7교통방해 현수막 제거*  *(1/1) G: 2017/11/23 14:23:45G:*","2017-11-23","","2017-11-30","진서면","처리완료","국사봉2나길"
"68","5월24일 칠성1길 밤샘불법주차 보고서","군산시청에서 일하시는 공무원 너무너무 일을 안하시네요.칠성1길 밤샘불법주차 때문에 사람 하나 죽어야 일하시려고 그러시나요?칠성1길 밤샘불법주차 문제로 사망사고및사고 발생시 문동신시장님및관련직원분들 어떠한 책임을 지실지 보겠습니다.","2017-05-25","2017-05-25","2017-06-05","직소민원팀","처리완료","상도로15아길"
"69","군산시에 시장님은 계십니까?","시장님! 군산시에 시장님은 계십니까?어린이가 행복한 도시, 아동친화도시를 하시겠다고 하시던데 왜 아동 1400여 명이 먹는 지역아동센터 급식에 대해서는 잠잠하십니까?시범실시 포함 무려 1년이 넘도록 아동들이 먹는 밥 그릇 갈등이 매우 심각한데 왜 시설장들에게 한 번도 나타나시지 않습니까?시민의 한 사람으로서 도저히 납득이 가지 않습니다.당황스럽습니다.이유가 무엇입니까?다른 지자체장과 비교해 볼 때 너무 무관심하시니 시장님이 계시지 않는 것 같습니다.시장님이 보실 때 손주나 손녀 같은 아동이 1400여 명이나 됩니다.아동들이 먹는 밥그릇 가지고 이러하니 부모된 자로서 너무 부끄럽습니다.너무 염치가 없는 불통이라고는 생각지 않으십니까?다른 사소한 행사에는 잘 가시던데...지금이라도 관심을 가져 주시기 바랍니다. 2016년 10월 03일 나 바로세우기 지역아동센터시설장 장재훈 목사 올림","2016-10-03","2016-10-03","","어린이행복과","처리중","상도로30길"
"70","똥냄새 좀 제발","익산시 춘포면 거주자입니다.한동안 안나던 똥냄새가 저녁 8시부터 지금까지 작렬하네요.창문도 못열고 몇 시간동안 환기도 못 시키고 있자니..짜증이 납니다.날짜를 보니 선거기간동안은 안나던 똥내가 선거가 끝나니 속이 뒤집어지고 메스꺼울정도로 진동을 합니다.그동안 안나던걸 한 번에 푸는건가 싶을정도로 심하네요.어제 오늘 일이 아니었지만 여기 사는동안 해결해준 적은 없습니다. 그러니 지금도 냄새가 나고 있겠지만요. 뭘 어떻게해야 이냄새를 더이상 맡지 않고 살 수 있도록 조치해주실 건가요?냄새의 진원지를 알아내서 장소라면 폭파라도 시켜버리고 싶은 심정이고회사라면 사장 멱살이라도 잡고 흔들고 계란이라도 던지고 싶습니다. 여태까지 냄새 해결해준다고 공략 세워놓고 당선된 후 지키지 않은 의원들도 양심을 팔아먹은 작자들입니다. 진절머리가 나네요. 이번 지방선거때 투표도 참여한 유권자로써 당당하게 요구합니다. 해결책 좀 마련해주세요.익산시 끝자락에 사는 시민들이 다 떠나기전에 말이죠.","2018-06-15","2018-06-15","2018-06-20","녹색환경과","처리완료","상도로30길"
"71","공공장소 반려견 목줄","중앙체육공원 미륵산등을 자주 이용합니다. 제가 제일 불편한 점은 반려견들 목줄 착용을 안한다는 겁니다. 모악산 은파공원등을 다녀보면 목줄을 거의 착용하는데 유독 미륵산과 중체에서는 당연히 목줄없이 반려견들과 산책하시는 분들이 많은데요 시차원에서 입구쪽에 목줄 착용안할시 적용할수있는 벌금등을 고지한 플랭카드라도 게시해주셨으면 좋겠습니다.시에서 발간한 홍보물에도 꼭 기재해주시면 감사하겠습니다","2017-10-23","2017-10-23","2017-10-26","체육진흥과","처리완료","상도로30길"
"72","영등제일1차아파트 사거리 횡단보도 안전문제","익산시정 업무에 수고 많으십니다제안 드리고 싶은 내용은  영등 제일1차아파트 사거리 보광교회 에서 아파트로 가는횡단보도를  건너다 보니  향나무 가로수로 인해 홈플러스 사거리에서 오는 차량이 보이지 않아서자칫 사고 위험이 있습니다이 횡단보도는 남성 중.고등학생등 주로 학생들이 많이 이용하는 횡단보도인데 왼쪽에서 오는 차량이  보이지 않는다면 안전에 심각한 문제가 됩니다검토 바랍니다..","2017-08-14","2017-08-14","2017-08-17","도로공원과","처리완료","상도로30길"
"73","상생","최근 주말에  모현도서관 옆 운동장에서 강아지 주인과... 도로를 운동하던 분과의 마찰이 있는것을 목격했습니다.말싸움 끝에 결국 경찰까지 출동 하더라구요...들어본즉... 두분 모두의 말이 틀린 얘기는 아니더라구요... 강아지에 대한 거부감이 없는 저로서는...공원이 익산시민모두의 공간이기에 강아지 주인의 입장도 이해가 되고... 운동을 하시고 ..강아지를 싫어하시는 분들의 마음도 이해가되더라구요... 그러다가 전주나 다른 타 도시에 강아지들이 뛰어 놀수 있는 공간을 마련해 놓은 지자체 기를 듣게되었습니다. 물론 잘 시행이 되고 있는지는 모르겠으나... 우리 익산도 큰 공간이 아니라.. 조그만 공간만 견주들에게만들어 준다면... 이런 문제가 없지 않을까 하는 생각이 들어라구요..  운동하시는 분들은 강아지 목줄을 해달라고 말씀 하시고,  강아지를 데리고 오신분들은... 운동하는데 방해가 되지 않게 할테니 양해해달라고 말하고... 듣고 있자니안타깝더라구요.. 우리 익산에 공원이 서동 공원을 빼고는 4군데 정도가 되는데... 그곳에 조금만 할애해서 울타리를쳐준다면.. 모두에게 좋은일이 아닐까 라는 생각이 들더라구요... 커다란 예산이 들것 같지는 않은데 말이죠...  ","2017-08-08","2017-08-08","2017-08-10","도로공원과","처리완료","상도로30길"
"74","버스 표지판. 설치해 주세요","안녕하세요 여긴 함라면 칠목재로에 있는 함라산 등산로입구에 있는. 칠목마을입니다.  등산객들 많아져. 버스 이용하시는 분들도 많아 지셨는데요. 익산행 버스타는곳에 표지판이 없습니다그래서인지 등산객들이 아무데서나 버스를 타십니다.   그래서인지 버스기사님들이 마을주민들이 항상타던 곳에서 버스를 타면 왜 여기서 타냐 위로 올라와서타라. 하시며 뭐라 하십니다.그래서 원래 여기가 승강장이다 말씀드리면 위에서 타라고 뭐라하십니다. 버스탈때마다 실랑이 하는것도 그렇고. 버스 승강장 표지판만 있어도 이런. 불편함은 없을것 같은데요. 꼭. 승강장 표지판 좀 세워 주세요꼭. 부탁 드립니다!","2016-09-26","2016-09-26","2016-09-28","교통행정과","처리완료","상도로30길"
"75","333번 버스 익산여객 1308","제가 5월 25일 오후 6시 10~20분쯤 사이에 북부시장에서 원대병원 방향으로 가는 333번 버스를북부시장에서 승차했습니다그리고 원대병원에서 하차하려고 미리 하차벨을 눌렀고 버스는 원대병원에서 정차하였습니다그러나 버스 기사님은 앞문만 열어서 승객들을 태우고 뒷문을 열어주지 않으시더라구요버스기사님이 잊으셨나해서 저는 뒷문을 두드리고 기사님 뒷 문 좀 열어주세요 라고 두차례 말했으나 열어주지 않으시더라구요 버스에 있던 승객들 다 저 쳐다보기까지 했습니다저는 참다 앞문 쪽으로 갔고 기사님한테 왜 뒷문 안열어주세요? 라고 말을 햇는데 저를 쳐다보지도 않더라구요 완전 투명인간 취급...버스기사님 귀 안들리시는 분 뽑은거 아니죠?쳐다보지도 않으시고해서 저는 앞문으로 내렸습니다 내릴때까지 반응도 없으시더라구요버스에 씨씨티비 있으니까 확인해보시구요어떻게 저런사람이 버스 운행을 합니까 기본적인것도 갖춰지지않을 사람을...너무 기분도 나쁘고 어이가 없었습니다 그럼 버스 뒷문을 기사가 열어주지 누가 열어주는지뭐 승객이 문 열어야하나요? 제가 늦게 벨을 누른것도 아니고 미리 하차벨을 눌렀고 문도 두드리고 문열어주세요라고 말까지 했는데 무시하시고...운행했던 기사님 더 이상 버스 운행 안하셨으면 좋겠고 그 기사님한테 사과 받고 싶습니다","2016-05-25","2016-05-25","2016-05-27","교통행정과","처리완료","상도로30길"
"76","(SPP-1703-2901405)시야를 가리는 불법 광고 게시물 제거해주세요","전라북도 부안군 진서면 진서리 795-1시야를 가리는 불법 광고 게시물 제거해주세요","2017-03-29","","2017-03-31","진서면","처리완료","상도로30길"
"77","(SPP-1708-1100555)상서면 575 가로등불이 나감 * 첨부파일촬영시간","전라북도 부안군 상서면 감교리 689-1상서면 575 가로등불이 나감*  *(1/1) G: 2017/08/10 11:56:34G:*","2017-08-11","","2017-08-21","상서면","처리완료","상도로30길"
"78","[생활불편신고]불법광고물","<불법광고물> 불법광고물 (1/1) A : 2017.09.07 15:10:13 A :  : I :  .[ (02-2195-1129~30)]","2017-09-07","","2017-09-15","계화면","처리완료","상도로30길"
"79","(SPP-1710-2500670)상설시장 앞 도로 위에 물이고여 있어 자동차가 지나갈","전라북도 부안군 부안읍 서외리 29-3상설시장 앞 도로 위에 물이고여 있어 자동차가 지나갈시 보행자가 물벼락을 맞을 위험이 농후합니다한번 고민해 주세요*  *(1/1) C: 2017/10/25 17:20:44G:*","2017-10-25","","2017-11-02","건설교통과","처리완료","상도로30길"
"80","(SPP-1803-0500419)가로등 불이 안들어옵니다 * 첨부파일촬영시간 안내(안","전라북도 부안군 보안면 남포리 524가로등 불이 안들어옵니다*  *(1/1) G: 2018/03/05 13:54:28G:  *","2018-03-05","","2018-03-07","보안면","처리완료","상도로30길"
"81","폐지 수집용 손수레 등의 광고·홍보 대행을 통한 상호 윈 윈 제고방안","폐지 수집용 손수레 등의 광고·홍보 대행을 통한 상호 윈 윈 제고방안","2018-04-23","","2018-04-23","기획예산과","처리완료","성대로6나길"
"82","생활쓰레기 처리 문제","저는 익산시 원봉길 50-1 (정족동 337-11)에 살고 있는 시민입니다.저희는 당초 생활쓰레기는 2주에 1회 , 재활용쓰레기는 1달에 1회 정도를 임상버스정류장 앞에 버려왔습니다.하나로변에서 원고가는 방향에 위치한 버스정류장입니다.최근 버스정류장에 쓰레기를 버리지 말라고 하며 줄을 쳐놓은 상태입니다.저희집은 갈뫼 방향으로 200m 안쪽에 위치해있어 쓰레기 배출할때 그곳으로 걸어가 배출하였으나지금은 어디다 배출해야할지 모르고 있습니다.삼성동사무소 출장소에 의뢰한바 화요일과 목요일 생활쓰레기를 수거한다고 전날 그곳에 가져다 놓으라고 했지만목요일 아침 가져다 놓은 생활쓰레기 봉지는 옷 수거함 뒤쪽에 버려진채 수거해가지 않았습니다.저희 쓰레기가 그렇게 방치되는 것도 싫고 버릴곳이 마땅이 없는것도 싫습니다.적당한 쓰레기 모으는 장소를 알려주시거나저희집 앞에도 하루 6회정도 버스가 들어가는 동네이므로2주에 1번꼴로 생활쓰레기 수거날짜를 정하여 집앞에서 수거해 주시고 1달 1회정도 재활용 쓰레기를 수거하는 날짜를 정하여 수거해 주실수 있는 방안을 모색해 주시기바랍니다.동네 어르신들은 많이들 태우고 계신것 같지만 생활쓰레기를 태우는 자체가 불법으로 알고 있습니다.. 대책을 강구해 주시면 감사하겠습니다. ","2017-06-02","2017-06-02","2017-06-07","청소자원과","처리완료","성대로6나길"
"83","악취해결해주세요","여전히 새벽에 날아오는 악취가 심합니다창문열기가 두렵습니다액비공장의 똥냄새가 심해요바람이 안불면 냄새가 덜하다가 바람이 분다싶으면 심하게 냄새가 납니다이 더운 여름 바람부는데 창문을 열지 못하는건 피해가 아닐까요?손해배상 청구해야되는거 아닌가?","2018-08-03","","2018-08-13","친환경축산과","처리완료","성산로2길"
"84","아파트 신축부지 스레이트지붕등의 철거에 따른 비산먼지등을 방지하여주십시오,","1) 익산시 평동로 아파트 신축부지 중, 평동로 767-9의 건물의 스레트지붕을어제(1/20 토)와 오늘(1/21 일) 첨부 사진과 같이 비산먼지등의 방지 대책을실시하지 아니하고 스레이트 지붕의 철거 작업을 하고 있기에, 오늘 9시15분, 9시39분 익산시청 민원실 (1577-0072)에 비산먼지 발생 방지시설을 하고 철거작업을 할 수 있도록 요청과 이의 확인을 요청 한바 &ldquo;적격한 업체에서 철거중이다&rdquo;라고 시공사에서 답한다는 라는 답변을 들었습니다.적격업체의 철거여부보다, 현재 철거하고 있는 방법이 적법한 방법 인가 의문입니다. 작업자들은 방진작업복, 방진마스크 등을 착용하고 작업하면서, 철거작업중 발생되는 스레이트 비산먼지에 의한 인근주택 거주자들의 피해는 고려하지 않는 것 같습니다. 적법한 방법으로 철거작업이 이루어질 수 있도록 시정조치 하여주십시오.2) 익산시 평동로 아파트 신축부지 중, 평동로 767-15 2층 단독주택(콘크리트슬라브)의 철거를 위해 첨부한 사진과 같이 주택 앞면부위 일부에만 가름막을 설치 하여있습니다(1/21 현재). 오늘 이후 철거 할 것으로 예상이 되는데, 철거과정에서 발생되는 비산먼지, 진동, 소음으로 인한, 인근주택에 피해가 발생하지 않도록 하여주시길 바랍니다. 아파트 신축부지의 주택 철거 작업실시후 발생되는 비산먼지, 진동, 소음으로 인해 생활에 불편이 발생되고 있습니다.본인이 작성한 &ldquo;시정에 바란다&rdquo;는 아파트 신축에 따른 기존주택 철거시 발생한 생활불편이 있기에 시정에 바란는 것이지, 익산시청 공무원을 힘들게 하고, 공사를 방해하려는 것은 아닙니다","2018-01-21","2018-01-21","","","처리중","모래내로17안길"
"85","(SPP-1703-2400726)쓰레기를 치워주세요","전라북도 부안군 부안읍 동중리 252쓰레기를 치워주세요","2017-03-24","","2017-03-31","부안읍","처리완료","북아현로4마길"
"86","(SPP-1710-2400328)가로등 고처주세요 * 첨부파일촬영시간 안내(안전신문고","전라북도 부안군 변산면 운산리 369-2가로등 고처주세요*  *(1/1) G: 2017/10/24 13:43:44G:*","2017-10-24","","2017-10-26","변산면","처리완료","연희로36길"
"87","부안군 부안읍 동중1길 주차장 터 개똥 민원 처리 부탁드립니다.","더운 날씨에 읍의 발전을 위해 항상 고생 많으십니다. 부안군 부안읍 동중4 경로당 뒤편 (동중1길) 공영주차장을 이용하는 주민입니다.주차장이 처음 생겼을때부터 종종 이용하고 있는데 최근 들어 주차장 관리가 너무 되지 않고있어 사용하기가 불편합니다. 1. 주차장에 개 똥이 너무 많아서 주차장 근처에만 가도 개똥 냄새가 진동합니다.주차장 앞편 우리 미용실과 경북여인숙 등에서 키우는 2-3마리 개들 및 동네 개들이 다 그 주차장에서 똥을 싸놓고 갑니다. 제가 그 광경을 몇번이나 발견했는지 모릅니다. 오죽하면 그 개가 어느 집으로 들어가는지 까지 확인을 했겠습니까.주차장에 가보시면 개똥이 천지여서 주차장에서 차를 대고 내릴때, 신발에 밟힌 적도 있고, 차 타이어에서도 냄새가 날 정도입니다. 아주 동네 주민들이 대 놓고 그 주차장에 개들을 풀어놓는것 같은데.. 참다참다 민원을 올립니다. 공영 주차장인 만큼 개똥을 치우지 않았을 때 벌금을 물린다는 표지판 정도는 세워져야 하는 것이 아닌지요. 기본이 지켜지지 않은 만큼 경고 표지판은 필요하다고 봅니다. 더 이상 방관하고 있을 수가 없습니다. 비라도 오면 냄새가 더 납니다.2. 주차장 근처 잡풀과 꽃밭에 대한 관리가 처음과 달리 잘 되고 있지 않습니다. 꽃밭을 관리하는 사람도 안 보이고 폐기물 및 잡자재가 주차장 근처에 널려 있는데 미관상 좋지 않고, 이용하는 사람 입장에서도 불편합니다. 주차장에 잡풀이 엉성함. 큰 세금을 들여 설립한 공영 주차장인 만큼 깨끗하게 관리되어 부안에 좋은 이미지를 심어줄 수 있도록 지속적인 관리 부탁드리며, 이용하는 주민에게도 혐오감이 들지 않도록 현재 쌓여져 있는 묵은 개똥을 깨끗이 처리하고, 근처 개를 키우는 주민들에게 각성할 수 있는 개똥 금지(벌금형) 표지판을 세워 앞으로도 깨끗하게 관리될 수 있도록 조처를 요청드리는 바입니다. 현장 확인하시어 조속 조치될 수 있도록 부탁드리며, 향후 본 민원 처리 계획에 대한 조처 계획을 안내하여 주시기 바랍니다. 감사합니다.","2017-07-05","","2017-07-12","친환경축산과","처리완료","강남대로34길"
"88","함열 버스","대학로에서 함열까지 가는 저녘시간 때 버스를 늘려 주셨으면 합니다.조별과제나 개인적인 일이 있을 때에는 대학로에 있다가 함열 가는 버스를 타는데1시간이나 기다려야 되는 경우가 있습니다. 그 때마다 불편함을 겪고 있었습니다. 버스 다니는시간을1시간보다는 20~30분으로 줄여서 기다리는데 불편함을 겪지 않도록 대학로에서 함열 가는 저녘버스가 많았으면 합니다.","2017-05-22","2017-05-22","2017-05-26","교통행정과","처리완료","강남대로51길"
"89","하나로 횡단보도 led등 연장점등부탁드림니다.","안녕하세요..어양동 근린공원 앞쪽 하나로 삼거리의 하나로 을 위한 횡단보도가있습니다.저를 비롯한 저희 직원 몇분이 퇴근후 새벽 1시~1시 30분 사이에 그 횡단보도를 통하여하나로 횡단을 하고있는데 횡단보도 보행자를 위한 led등이 꺼져있어 멀리서 오는 차량이보행중인 사람 인식이 어려운것 같습니다.근본적인 문제는 새벽시간대의 차량 과속이 원인이긴 하지만저희는 보행시 많은 위험을 느끼게 됨니다.led등이 없으면 모를까 설치되어있으니 좀 늦은시간까지 켜주셨으면 감사하겠습니다. 그리고 추가로 하나로도로상 e편한세상에서 익산초등학교 등하교시 과속에의한 학생들의안전을 위해 과속단속 카메라가 설치되는것으로 알고있었는데... 미뤄지기만 하고 설치가않되는것 같아 문의드림니다.과속 단속 카메라 설치 진행상황도 같이 답변 부탁드림니다.","2016-03-30","2016-03-30","2016-04-01","교통행정과","처리완료","강남대로6길"
"90","(SPP-1703-2901345)예술회관 가로등 꺼짐","전라북도 부안군 부안읍 서외리 455-41예술회관 가로등 꺼짐","2017-03-29","","2017-04-05","문화체육시설사업소","처리완료","남부순환로354길"
"91","(SPP-1710-1100267)불법현수막 제거요청 * 첨부파일촬영시간 안내(안전신","전라북도 부안군 부안읍 동중리 227-9불법현수막 제거요청*  *(1/1) G: 2017/10/11 13:19:41G:*","2017-10-11","","2017-10-16","부안읍","처리완료","남부순환로354길"
"92","마을표지석이동건","무풍면 금평리 부평마을 마을표지석으로 인해 저희 집 화장실쪽으로 표지석이 그 무게때문에 기울어지고 담장도 무너져 내려서작년부터 이장님과 면사무소에 민원을 청원하였으나차일피일 해준다는 말 뿐 실행되지 않아 군수님께 이 글을씁니다절차에 따라 일을 원활히 하고 싶었으나 이렇게 글과 사진을 올립니다조속한 해결을 부탁드립니다","2018-08-21","2018-08-21","2018-08-28","자치행정과","처리완료","바우뫼로"
"93","익산유기동물보호소","sns유기동물 공고 관련하여 시정조치 부탁드립니다.반려동물 인구 천만시대입니다.많은 반려인들이 유기동물 공고에 얼마나 관심이 많으며 안쓰러워하는지 아시나요?물론 마구잡이로 버린 인간들 잘못이지만 누군가에게 자식처럼 사랑 받을수 있는 아이들입니다.수당제도?이런 글도 올라오는것 같은데 함부로 유기동물을 대하는 자세는 아닌것같네요.앞으로 예의주시 할 겁니다. 공고 끝났다고 칼같이 안락사 시키는 그런 곳하고는 다르길 바라며..동물을 진정으로 사랑하는 사람이 보호소를 운영하셨으면 하구요 지금 심장이 터질것 같지만 이쯤에서 끝내도록 하겠습니다.","2016-11-09","2016-11-09","2016-11-10","축산과","처리완료","서초대로"
"94","(SPP-1801-2300169)줄포면 하수관거 사업을하면서 나오는 폐석재들을 마을입구","전라북도 부안군 줄포면 줄포리 786-5줄포면 하수관거 사업을하면서 나오는 폐석재들을 마을입구에 적재해 협소한도로에 주민들 교통불편과 미관상좋지않으며 적재하면서나오는 분진과소음 때문에 주민들불편이 이만저만이 아님.이로인해 해당기관에 민원을제기해 2017년12월30일까지 비워주기로 했는대 아직까지 이행대지 않아 주민불편이 많음.*  *(1/4) G: 2018/01/23 13:46:17(2/4) G: 2018/01/23 13:46:10(3/4) G: 2018/01/23 13:45:30(4/4) G: 2018/01/23 13:44:51G:  *","2018-01-23","","2018-01-31","맑은물사업소","처리완료","신반포로15길"
